{
  "schema_version": 1,
  "index_url": "https://docs.nvidia.com/vss/3.2.1/index.html",
  "captured_on": "2026-07-31",
  "extraction_rule": "distinct href targets ending in .html, fragment removed, resolved under the exact VSS 3.2.1 docs base; index.html itself is not a linked target",
  "target_count": 152,
  "target_set_sha256": "b70c4d6979c3ea2b60e41a5352704aba8e14c39773bde8159e1c725242265f28",
  "targets": [
    "https://docs.nvidia.com/vss/3.2.1/API-Reference.html",
    "https://docs.nvidia.com/vss/3.2.1/Calibration-Camera-Positioning-Guide.html",
    "https://docs.nvidia.com/vss/3.2.1/JSON-Schema.html",
    "https://docs.nvidia.com/vss/3.2.1/Known-Limitations.html",
    "https://docs.nvidia.com/vss/3.2.1/License-Information.html",
    "https://docs.nvidia.com/vss/3.2.1/NvSchema.html",
    "https://docs.nvidia.com/vss/3.2.1/Protobuf-Schema.html",
    "https://docs.nvidia.com/vss/3.2.1/VSS-Agents.html",
    "https://docs.nvidia.com/vss/3.2.1/agent-harnesses.html",
    "https://docs.nvidia.com/vss/3.2.1/agent-skills.html",
    "https://docs.nvidia.com/vss/3.2.1/agent-workflow-alert-verification.html",
    "https://docs.nvidia.com/vss/3.2.1/agent-workflow-lvs.html",
    "https://docs.nvidia.com/vss/3.2.1/agent-workflow-rt-alert.html",
    "https://docs.nvidia.com/vss/3.2.1/agent-workflow-search.html",
    "https://docs.nvidia.com/vss/3.2.1/agent-workflows.html",
    "https://docs.nvidia.com/vss/3.2.1/alert-verification-api.html",
    "https://docs.nvidia.com/vss/3.2.1/alert-verification-service.html",
    "https://docs.nvidia.com/vss/3.2.1/analytics-microservices.html",
    "https://docs.nvidia.com/vss/3.2.1/api-gateway-mcp.html",
    "https://docs.nvidia.com/vss/3.2.1/auto-calibration.html",
    "https://docs.nvidia.com/vss/3.2.1/autocalib-custom-dataset.html",
    "https://docs.nvidia.com/vss/3.2.1/autocalib-getting-started.html",
    "https://docs.nvidia.com/vss/3.2.1/autocalib-troubleshooting.html",
    "https://docs.nvidia.com/vss/3.2.1/autocalib-workflow-steps.html",
    "https://docs.nvidia.com/vss/3.2.1/behavior-analytics.html",
    "https://docs.nvidia.com/vss/3.2.1/calibration-schema.html",
    "https://docs.nvidia.com/vss/3.2.1/calibration.html",
    "https://docs.nvidia.com/vss/3.2.1/cloud-brev.html",
    "https://docs.nvidia.com/vss/3.2.1/configuration-management.html",
    "https://docs.nvidia.com/vss/3.2.1/database.html",
    "https://docs.nvidia.com/vss/3.2.1/deepstream-configurator.html",
    "https://docs.nvidia.com/vss/3.2.1/deployments.html",
    "https://docs.nvidia.com/vss/3.2.1/edge-deployment.html",
    "https://docs.nvidia.com/vss/3.2.1/elk.html",
    "https://docs.nvidia.com/vss/3.2.1/faq.html",
    "https://docs.nvidia.com/vss/3.2.1/genindex.html",
    "https://docs.nvidia.com/vss/3.2.1/getting-started.html",
    "https://docs.nvidia.com/vss/3.2.1/helm-deployment.html",
    "https://docs.nvidia.com/vss/3.2.1/industry-examples.html",
    "https://docs.nvidia.com/vss/3.2.1/kafka.html",
    "https://docs.nvidia.com/vss/3.2.1/legacy-calibration.html",
    "https://docs.nvidia.com/vss/3.2.1/licenses.html",
    "https://docs.nvidia.com/vss/3.2.1/long-video-summarization-api.html",
    "https://docs.nvidia.com/vss/3.2.1/long-video-summarization.html",
    "https://docs.nvidia.com/vss/3.2.1/message-broker.html",
    "https://docs.nvidia.com/vss/3.2.1/middleware.html",
    "https://docs.nvidia.com/vss/3.2.1/models/clip-object-embeddings.html",
    "https://docs.nvidia.com/vss/3.2.1/models/cosmos-embed1.html",
    "https://docs.nvidia.com/vss/3.2.1/models/index.html",
    "https://docs.nvidia.com/vss/3.2.1/models/model-customization.html",
    "https://docs.nvidia.com/vss/3.2.1/models/rt-detr.html",
    "https://docs.nvidia.com/vss/3.2.1/models/sparse4d.html",
    "https://docs.nvidia.com/vss/3.2.1/nemoclaw-configuration.html",
    "https://docs.nvidia.com/vss/3.2.1/nemoclaw-deploy-vss-and-skills.html",
    "https://docs.nvidia.com/vss/3.2.1/nemoclaw-troubleshooting.html",
    "https://docs.nvidia.com/vss/3.2.1/nemoclaw.html",
    "https://docs.nvidia.com/vss/3.2.1/object-detection-tracking-api.html",
    "https://docs.nvidia.com/vss/3.2.1/object-detection-tracking.html",
    "https://docs.nvidia.com/vss/3.2.1/observability.html",
    "https://docs.nvidia.com/vss/3.2.1/performance-alert-verification.html",
    "https://docs.nvidia.com/vss/3.2.1/performance-lvs.html",
    "https://docs.nvidia.com/vss/3.2.1/performance-rt-cv.html",
    "https://docs.nvidia.com/vss/3.2.1/performance-rt-embed.html",
    "https://docs.nvidia.com/vss/3.2.1/performance-rt-vlm.html",
    "https://docs.nvidia.com/vss/3.2.1/performance-search.html",
    "https://docs.nvidia.com/vss/3.2.1/performance-vios.html",
    "https://docs.nvidia.com/vss/3.2.1/performance.html",
    "https://docs.nvidia.com/vss/3.2.1/prerequisites.html",
    "https://docs.nvidia.com/vss/3.2.1/quickstart.html",
    "https://docs.nvidia.com/vss/3.2.1/real-time-embedding-api.html",
    "https://docs.nvidia.com/vss/3.2.1/real-time-embedding.html",
    "https://docs.nvidia.com/vss/3.2.1/real-time-vlm-api.html",
    "https://docs.nvidia.com/vss/3.2.1/real-time-vlm.html",
    "https://docs.nvidia.com/vss/3.2.1/redis.html",
    "https://docs.nvidia.com/vss/3.2.1/release-notes-ver-2.html",
    "https://docs.nvidia.com/vss/3.2.1/release-notes.html",
    "https://docs.nvidia.com/vss/3.2.1/sdg-calibration.html",
    "https://docs.nvidia.com/vss/3.2.1/sdrc.html",
    "https://docs.nvidia.com/vss/3.2.1/search.html",
    "https://docs.nvidia.com/vss/3.2.1/secure-deployment.html",
    "https://docs.nvidia.com/vss/3.2.1/smartcity-docs/Blueprint-deep-dive.html",
    "https://docs.nvidia.com/vss/3.2.1/smartcity-docs/Calibration.html",
    "https://docs.nvidia.com/vss/3.2.1/smartcity-docs/Deployment.html",
    "https://docs.nvidia.com/vss/3.2.1/smartcity-docs/FAQ.html",
    "https://docs.nvidia.com/vss/3.2.1/smartcity-docs/Introduction.html",
    "https://docs.nvidia.com/vss/3.2.1/smartcity-docs/Known-Limitations.html",
    "https://docs.nvidia.com/vss/3.2.1/smartcity-docs/License-Information.html",
    "https://docs.nvidia.com/vss/3.2.1/smartcity-docs/Model-Fine-Tuning.html",
    "https://docs.nvidia.com/vss/3.2.1/smartcity-docs/Operations.html",
    "https://docs.nvidia.com/vss/3.2.1/smartcity-docs/Prerequisites.html",
    "https://docs.nvidia.com/vss/3.2.1/smartcity-docs/Quickstart-Guide.html",
    "https://docs.nvidia.com/vss/3.2.1/smartcity-docs/Simulation-SDG.html",
    "https://docs.nvidia.com/vss/3.2.1/smartcity-docs/Smartcity-Development-Workflow.html",
    "https://docs.nvidia.com/vss/3.2.1/smartcity-docs/Troubleshooting-Guide.html",
    "https://docs.nvidia.com/vss/3.2.1/smartcity-docs/smartcity-toc.html",
    "https://docs.nvidia.com/vss/3.2.1/video-analytics-api-server.html",
    "https://docs.nvidia.com/vss/3.2.1/video-analytics-api.html",
    "https://docs.nvidia.com/vss/3.2.1/video-analytics-mcp.html",
    "https://docs.nvidia.com/vss/3.2.1/vios-microservices.html",
    "https://docs.nvidia.com/vss/3.2.1/vios-nvstreamer.html",
    "https://docs.nvidia.com/vss/3.2.1/vision-microservices.html",
    "https://docs.nvidia.com/vss/3.2.1/vss-agent/VSS-Agent-Configuration.html",
    "https://docs.nvidia.com/vss/3.2.1/vss-agent/VSS-Agent-Customization.html",
    "https://docs.nvidia.com/vss/3.2.1/vss-agent/VSS-Agent-Evaluation.html",
    "https://docs.nvidia.com/vss/3.2.1/vss-agent/VSS-Agent-Known-Issues.html",
    "https://docs.nvidia.com/vss/3.2.1/vss-agent/VSS-Agent-Overview.html",
    "https://docs.nvidia.com/vss/3.2.1/vss-agent/VSS-Agent-Profiles.html",
    "https://docs.nvidia.com/vss/3.2.1/vss-agent/Video-Analytics-MCP-Server.html",
    "https://docs.nvidia.com/vss/3.2.1/vss-agent/configure-llm.html",
    "https://docs.nvidia.com/vss/3.2.1/vss-agent/configure-vlm.html",
    "https://docs.nvidia.com/vss/3.2.1/vss-agent/vss-agent-Observability.html",
    "https://docs.nvidia.com/vss/3.2.1/vss-agent/vss-agent-api.html",
    "https://docs.nvidia.com/vss/3.2.1/vss-agent/vss-agent-report-generation.html",
    "https://docs.nvidia.com/vss/3.2.1/vss-configurator.html",
    "https://docs.nvidia.com/vss/3.2.1/vss-orchestrator-mcp.html",
    "https://docs.nvidia.com/vss/3.2.1/vss-scale.html",
    "https://docs.nvidia.com/vss/3.2.1/vss-ui.html",
    "https://docs.nvidia.com/vss/3.2.1/vss-vios.html",
    "https://docs.nvidia.com/vss/3.2.1/vst-live-stream-management-api-reference.html",
    "https://docs.nvidia.com/vss/3.2.1/vst-live-stream-management-api.html",
    "https://docs.nvidia.com/vss/3.2.1/vst-proxy-stream-management-api-reference.html",
    "https://docs.nvidia.com/vss/3.2.1/vst-proxy-stream-management-api.html",
    "https://docs.nvidia.com/vss/3.2.1/vst-record-stream-management-api-reference.html",
    "https://docs.nvidia.com/vss/3.2.1/vst-record-stream-management-api.html",
    "https://docs.nvidia.com/vss/3.2.1/vst-replay-stream-management-api-reference.html",
    "https://docs.nvidia.com/vss/3.2.1/vst-replay-stream-management-api.html",
    "https://docs.nvidia.com/vss/3.2.1/vst-sensor-management-api-reference.html",
    "https://docs.nvidia.com/vss/3.2.1/vst-sensor-management-api.html",
    "https://docs.nvidia.com/vss/3.2.1/vst-storage-management-api-reference.html",
    "https://docs.nvidia.com/vss/3.2.1/vst-storage-management-api.html",
    "https://docs.nvidia.com/vss/3.2.1/warehouse-docs/Accuracy-Performance-Benchmarks.html",
    "https://docs.nvidia.com/vss/3.2.1/warehouse-docs/Appendix-toc.html",
    "https://docs.nvidia.com/vss/3.2.1/warehouse-docs/Behavior-Analytics.html",
    "https://docs.nvidia.com/vss/3.2.1/warehouse-docs/Core-Development-Workflow.html",
    "https://docs.nvidia.com/vss/3.2.1/warehouse-docs/FAQ.html",
    "https://docs.nvidia.com/vss/3.2.1/warehouse-docs/Introduction.html",
    "https://docs.nvidia.com/vss/3.2.1/warehouse-docs/Known-Limitations.html",
    "https://docs.nvidia.com/vss/3.2.1/warehouse-docs/License-Information.html",
    "https://docs.nvidia.com/vss/3.2.1/warehouse-docs/Models.html",